{
  "id": "typescript-05-implements-vs-extends",
  "slug": "implements-vs-extends",
  "title": "implements versus extends — interface versus inheritance",
  "moduleId": "typescript-05-classes-interfaces-oop",
  "order": 5,
  "hook": "implements versus extends — interface versus inheritance in JavaScript is prototype-based with class syntax sugar; TypeScript adds nominal-like modifiers but structural typing remains. Differs from C# sealed classes and virtual dispatch.",
  "sections": [
    {
      "heading": "What is implements versus extends — interface versus inheritance?",
      "blocks": [
        {
          "type": "prose",
          "text": "**implements versus extends — interface versus inheritance** is a compile-time TypeScript concept that erases at emit — the run-time behavior is still JavaScript. implements versus extends — interface versus inheritance in JavaScript is prototype-based with class syntax sugar; TypeScript adds nominal-like modifiers but structural typing remains. This section defines terms before code — read the glossary, then run the snippets in Node or the browser console."
        },
        {
          "type": "glossary",
          "title": "Key terms",
          "entries": [
            {
              "term": "implements",
              "longForm": "implements versus extends — interface versus inheritance",
              "plainDefinition": "Core TypeScript mechanism for implements versus extends — interface versus inheritance.",
              "example": "Runnable examples in the code walkthrough below."
            },
            {
              "term": "structural typing",
              "longForm": "structural typing",
              "plainDefinition": "Types compatible if shape matches — unlike C# nominal types.",
              "example": "{ id: string } assignable to interface User"
            },
            {
              "term": "type erasure",
              "longForm": "type erasure",
              "plainDefinition": "TypeScript types removed at emit — run time is plain JS.",
              "example": "interface User erases completely"
            }
          ]
        }
      ]
    },
    {
      "heading": "Why implements versus extends — interface versus inheritance matters in production",
      "blocks": [
        {
          "type": "prose",
          "text": "Senior interviews and on-call debugging both test **implements versus extends — interface versus inheritance** beyond one-line definitions. Production failures here look like silent data corruption, memory growth, type errors at CI, or async ordering bugs — not syntax errors. If you know JavaScript, use the comparison table to transfer intuition instead of memorizing rules in isolation."
        },
        {
          "type": "callout",
          "variant": "tip",
          "title": "Interview trap",
          "body": "Interviewers ask \"implements versus extends — interface versus inheritance\" as a follow-up to system design or debugging exercises. They want mechanism, tradeoffs, and a concrete failure you have seen — not textbook definitions."
        }
      ]
    },
    {
      "heading": "How implements versus extends — interface versus inheritance works step by step",
      "blocks": [
        {
          "type": "steps",
          "title": "Mental model",
          "items": [
            {
              "title": "Locate in code",
              "body": "Find where implements versus extends — interface versus inheritance appears — syntax, API call, or type annotation."
            },
            {
              "title": "Trace behavior",
              "body": "Hover types in the editor, emit JS, verify what survives at run time."
            },
            {
              "title": "Test edge cases",
              "body": "Null input, empty collections, network failure, wrong types from JSON."
            },
            {
              "title": "Connect neighbors",
              "body": "Follow related topics at the bottom for closures, types, or async context."
            }
          ]
        },
        {
          "type": "diagram",
          "diagram": {
            "type": "mermaid",
            "title": "implements versus extends — interface versus inheritance flow",
            "source": "flowchart TD\n  A[implements versus extends — interface versus inheritance] --> B[Read / parse]\n  B --> C[Type check]\n  C --> D[Observable behavior]"
          }
        }
      ]
    },
    {
      "heading": "Code walkthrough: implements versus extends — interface versus inheritance",
      "blocks": [
        {
          "type": "snippet",
          "snippet": {
            "language": "typescript",
            "label": "Class inheritance",
            "code": "abstract class Repository<T extends { id: string }> {\n  protected items: T[] = [];\n  abstract findById(id: string): T | undefined;\n}\nclass UserRepo extends Repository<User> {\n  findById(id: string) { return this.items.find((u) => u.id === id); }\n}",
            "explanation": "extends sets prototype chain — TS abstract enforces overrides at compile time."
          }
        },
        {
          "type": "snippet",
          "snippet": {
            "language": "typescript",
            "label": "Interface contract",
            "code": "interface Logger { log(msg: string): void; }\nclass ConsoleLogger implements Logger { log(msg: string) { console.log(msg); } }\nemit({ log: (m) => process.stderr.write(m) }, 'warn'); // structural OK",
            "explanation": "implements documents intent; structural typing accepts matching shapes without keyword."
          }
        },
        {
          "type": "snippet",
          "snippet": {
            "language": "javascript",
            "label": "Prototype chain",
            "code": "const base = { greet() { return 'hi'; } };\nconst child = Object.create(base);\nchild.name = 'Ada';\nconsole.log(child.greet());",
            "explanation": "class desugars to constructor + prototype — explains this and super."
          }
        }
      ]
    },
    {
      "heading": "Compare with JavaScript and C#",
      "blocks": [
        {
          "type": "comparisonTable",
          "title": "implements versus extends — interface versus inheritance across languages",
          "headers": [
            "Aspect",
            "TypeScript",
            "C#",
            "JavaScript emit"
          ],
          "rows": [
            [
              "When checked",
              "Compile time",
              "Compile + CLR",
              "Compile only"
            ],
            [
              "Type model",
              "Structural static",
              "Nominal",
              "Structural"
            ],
            [
              "Typical pitfall",
              "Coercion / undefined",
              "Null reference",
              "any at boundary"
            ]
          ]
        }
      ]
    },
    {
      "heading": "Common mistakes to avoid",
      "blocks": [
        {
          "type": "callout",
          "variant": "warning",
          "title": "Pitfalls for implements versus extends — interface versus inheritance",
          "body": "Treating implements versus extends — interface versus inheritance as pure syntax without compile-time or run-time behavior. Skipping validation at API/JSON boundaries. Ignoring strict compiler flags differences. Hand-waving in design review without a test or metric."
        }
      ]
    }
  ],
  "interviewTakeaways": [
    "implements versus extends — interface versus inheritance: know definition plus one runnable example.",
    "Production: validate external input before applying implements versus extends — interface versus inheritance; log failures with context.",
    "Tradeoff: prefer explicit debuggable code over clever shortcuts for implements-vs-extends.",
    "60s: implements versus extends — interface versus inheritance — explain mechanism, one pitfall, one JS/C# comparison, and when not to use the advanced variant.",
    "Follow-up: trace a bug or extend the example to async/error/null paths."
  ],
  "commonPitfalls": [
    "Weak: dismisses implements versus extends — interface versus inheritance as syntax-only — fails when interviewer asks for run-time or compile-time mechanism.",
    "Weak: using any at boundaries without validation.",
    "Weak: cannot name a concrete production failure involving implements-vs-extends.",
    "Strong: define implements versus extends — interface versus inheritance, show a 5-line example, name one pitfall and one C# difference."
  ],
  "relatedTopicIds": [
    "typescript-05-classes-and-access-modifiers",
    "typescript-05-abstract-classes-and-methods",
    "typescript-05-interfaces-and-implements"
  ],
  "jsTsCorrelations": [
    {
      "language": "javascript",
      "concept": "implements versus extends — interface versus inheritance",
      "note": "implements versus extends — interface versus inheritance in javascript — same programmer mental model, run-time enforcement differs.",
      "futureTopicSlug": "javascript/classes-interfaces-oop/implements-vs-extends"
    }
  ],
  "officialSources": [
    {
      "title": "TypeScript handbook",
      "url": "https://www.typescriptlang.org/docs/handbook/intro.html"
    },
    {
      "title": "TypeScript release notes",
      "url": "https://www.typescriptlang.org/docs/handbook/release-notes/overview.html"
    }
  ],
  "animationHint": "compare",
  "scenarioTag": "rabbitmq"
}
