{
  "id": "typescript-07-optional-properties",
  "slug": "optional-properties",
  "title": "Optional properties (?), undefined, and exactOptionalPropertyTypes",
  "moduleId": "typescript-07-null-safety-strict",
  "order": 2,
  "hook": "Optional properties (?), undefined, and exactOptionalPropertyTypes shows up in everyday TypeScript and in senior interviews — this page explains what it is, why it matters, and how it behaves in the compiler versus JavaScript or C#.",
  "sections": [
    {
      "heading": "What is this?",
      "blocks": [
        {
          "type": "prose",
          "text": "Optional properties (?), undefined, and exactOptionalPropertyTypes is a core concept in TypeScript. At run time, types erase — the engine still executes JavaScript — but at compile time this concept shapes safe APIs and catches bugs before deploy. This page explains the idea in plain English first, then shows small, explained examples you can run in the browser console or Node.js."
        },
        {
          "type": "glossary",
          "title": "Key terms",
          "entries": [
            {
              "term": "optional",
              "longForm": "Optional properties (?), undefined, and exactOptionalPropertyTypes",
              "plainDefinition": "The central idea behind \"Optional properties (?), undefined, and exactOptionalPropertyTypes\" — how it appears in source code and what the compiler does with it.",
              "example": "See the code walkthrough section for a minimal working example."
            },
            {
              "term": "ECMAScript",
              "longForm": "ECMAScript",
              "plainDefinition": "The official specification that JavaScript implements. TypeScript is a typed superset that compiles to ECMAScript.",
              "example": "const, classes, and async/await are ECMAScript features."
            }
          ]
        }
      ]
    },
    {
      "heading": "Why does it matter?",
      "blocks": [
        {
          "type": "prose",
          "text": "Senior interviews and production code both probe whether you understand Optional properties (?), undefined, and exactOptionalPropertyTypes beyond syntax memorization. Misunderstanding here leads to subtle bugs — wrong equality results, leaked memory, untyped JSON boundaries, or async ordering surprises. If you know JavaScript, the comparison sections below help you transfer mental models instead of starting from zero."
        },
        {
          "type": "callout",
          "variant": "tip",
          "title": "Interview trap",
          "body": "Interviewers often ask \"Optional properties (?), undefined, and exactOptionalPropertyTypes\" as a follow-up to a coding exercise. They want mechanism and tradeoffs — not a one-line definition."
        }
      ]
    },
    {
      "heading": "How it works step by step",
      "blocks": [
        {
          "type": "steps",
          "title": "Mental model",
          "items": [
            {
              "title": "Read the syntax",
              "body": "Find where Optional properties (?), undefined, and exactOptionalPropertyTypes appears in real code — a function, type annotation, or runtime API."
            },
            {
              "title": "Trace execution",
              "body": "Hover types in your editor, then emit JS and read what survives at run time."
            },
            {
              "title": "Compare hosts",
              "body": "Browser and Node.js may differ — note which APIs are host-specific versus language features."
            },
            {
              "title": "Connect to neighbors",
              "body": "Use related links at the bottom to connect this topic to closures, types, or async in the same track."
            }
          ]
        },
        {
          "type": "diagram",
          "diagram": {
            "type": "mermaid",
            "title": "Optional properties (?), undefined, and exactOptionalPropertyTypes flow",
            "source": "flowchart TD\n  A[Source code] --> B[TypeScript checker]\n  B --> C[Emit JavaScript]\n  C --> D[Run in V8]\n  D --> E[Observable behavior]"
          }
        }
      ]
    },
    {
      "heading": "Code walkthrough",
      "blocks": [
        {
          "type": "snippet",
          "snippet": {
            "language": "typescript",
            "label": "Basic Optional properties (?), undefined, and exactOptionalPropertyTypes",
            "code": "// Optional properties (?), undefined, and exactOptionalPropertyTypes\ninterface Example {\n  topic: string;\n  active: boolean;\n}\n\nconst example: Example = {\n  topic: 'optional-properties',\n  active: true,\n};\n\nconsole.log(example.topic);",
            "explanation": "Lines 1–4: define a minimal value related to Optional properties (?), undefined, and exactOptionalPropertyTypes. Line 6: observe output — in TS, the checker validates shape before emit."
          }
        },
        {
          "type": "snippet",
          "snippet": {
            "language": "typescript",
            "label": "Production-shaped usage",
            "code": "type Payload = { id: string };\n\nfunction parsePayload(raw: unknown): Payload {\n  if (typeof raw !== 'object' || raw === null) throw new Error('invalid');\n  if (!('id' in raw) || typeof raw.id !== 'string') throw new Error('id required');\n  return { id: raw.id };\n}\n\nasync function handleRequest(raw: unknown) {\n  const payload = parsePayload(raw);\n  return fetch(`/api/items/${payload.id}`);\n}",
            "explanation": "Shows boundary validation — narrow unknown before trusting JSON."
          }
        },
        {
          "type": "snippet",
          "snippet": {
            "language": "javascript",
            "label": "Compare with JavaScript",
            "code": "// JavaScript at run time — types erased\nconst item = { id: 'abc' };\nconsole.log(item.id);",
            "explanation": "Highlights what JavaScript does differently at compile time versus run time."
          }
        }
      ]
    },
    {
      "heading": "Compare with JavaScript and C#",
      "blocks": [
        {
          "type": "comparisonTable",
          "title": "Optional properties (?), undefined, and exactOptionalPropertyTypes across languages",
          "headers": [
            "Aspect",
            "TypeScript",
            "JavaScript / C#"
          ],
          "rows": [
            [
              "When checked",
              "Compile time (types erase at run time)",
              "JS: run time; C#: compile + CLR"
            ],
            [
              "Type model",
              "Structural static types",
              "JS: dynamic; C#: nominal"
            ],
            [
              "Typical pitfall",
              "Coercion or silent undefined",
              "any at boundaries",
              "Null reference or blocking async"
            ]
          ]
        }
      ]
    },
    {
      "heading": "Common mistakes",
      "blocks": [
        {
          "type": "callout",
          "variant": "warning",
          "title": "Pitfalls to avoid",
          "body": "Treating Optional properties (?), undefined, and exactOptionalPropertyTypes as pure syntax without run-time behavior. Skipping validation at JSON or API boundaries. Saying \"it works on my machine\" without noting browser versus Node differences."
        }
      ]
    }
  ],
  "interviewTakeaways": [
    "Optional properties (?), undefined, and exactOptionalPropertyTypes: know the definition and one concrete code example.",
    "Tradeoff: prefer explicit, debuggable code over clever shortcuts for optional-properties.",
    "Production: validate external input before applying Optional properties (?), undefined, and exactOptionalPropertyTypes; log failures with context.",
    "60s: Optional properties (?), undefined, and exactOptionalPropertyTypes — explain mechanism, one pitfall, one comparison to JS/C#, and when you would not use the advanced variant.",
    "Follow-up: interviewer may ask you to trace a bug or extend the example to async/error paths."
  ],
  "commonPitfalls": [
    "Weak answer: \"Optional properties (?), undefined, and exactOptionalPropertyTypes is just syntax\" — rejected because interviews probe run-time behavior.",
    "Using any at API boundaries without validation.",
    "Strong answer: define Optional properties (?), undefined, and exactOptionalPropertyTypes, show a 5-line example, name one pitfall and one C# difference."
  ],
  "relatedTopicIds": [
    "typescript-07-strict-null-checks",
    "typescript-07-non-null-assertion",
    "typescript-07-definite-assignment"
  ],
  "jsTsCorrelations": [
    {
      "language": "javascript",
      "concept": "Optional properties (?), undefined, and exactOptionalPropertyTypes",
      "note": "Foundation link to javascript track for optional-properties.",
      "futureTopicSlug": "javascript/null-safety-strict/optional-properties"
    }
  ],
  "officialSources": [
    {
      "title": "TypeScript handbook",
      "url": "https://www.typescriptlang.org/docs/handbook/intro.html"
    },
    {
      "title": "TypeScript release notes",
      "url": "https://www.typescriptlang.org/docs/handbook/release-notes/overview.html"
    }
  ]
}
