{
  "id": "aws-16-well-architected-overview",
  "slug": "well-architected-overview",
  "title": "Well-Architected overview (framework and review workflow)",
  "moduleId": "aws-16-well-architected",
  "order": 1,
  "hook": "The AWS Well-Architected Framework organizes cloud design into six pillars with actionable best practices. A Well-Architected Review asks structured questions so you find high-risk gaps before customers do.",
  "sections": [
    {
      "heading": "What is this?",
      "blocks": [
        {
          "type": "prose",
          "text": "The framework is a lens for tradeoffs across six pillars: Operational Excellence, Security, Reliability, Performance Efficiency, Cost Optimization, and Sustainability. The Well-Architected Tool stores workloads, runs questionnaires, and tracks High-Risk Issues (HRIs). Lenses such as SaaS and Serverless add domain-specific questions."
        },
        {
          "type": "glossary",
          "title": "Key terms",
          "entries": [
            {
              "term": "Pillar",
              "longForm": "Well-Architected pillar",
              "plainDefinition": "Design focus area with principles and questions",
              "example": "Security pillar covers identity and data protection"
            },
            {
              "term": "HRI",
              "longForm": "High-Risk Issue",
              "plainDefinition": "Answer that violates best practice and needs remediation",
              "example": "Single-AZ production database"
            },
            {
              "term": "Lens",
              "longForm": "Well-Architected lens",
              "plainDefinition": "Domain overlay on core pillars",
              "example": "SaaS Lens for multi-tenant products"
            },
            {
              "term": "Workload",
              "longForm": "Defined workload",
              "plainDefinition": "Bounded system under review — accounts, regions, dependencies",
              "example": "payments-api prod in two regions"
            }
          ]
        }
      ]
    },
    {
      "heading": "Why does it matter?",
      "blocks": [
        {
          "type": "prose",
          "text": "Senior interviews expect pillar language with evidence. Production teams run quarterly Well-Architected Framework Reviews (WAFR) before major launches. Enterprise customers map your controls to Security and Reliability pillars."
        },
        {
          "type": "callout",
          "variant": "tip",
          "title": "Interview framing",
          "body": "Say: six pillars, review questions, HRIs — framework is continuous improvement, not a one-time checkbox."
        }
      ]
    },
    {
      "heading": "How it works step by step",
      "blocks": [
        {
          "type": "steps",
          "title": "Mechanism",
          "items": [
            {
              "title": "Define workload boundary",
              "body": "Scope environment, accounts, regions, and dependencies."
            },
            {
              "title": "Answer pillar questions",
              "body": "Complete questionnaires in Well-Architected Tool or workshop."
            },
            {
              "title": "Identify HRIs",
              "body": "Flag high-risk answers — missing backups, open ingress, no runbooks."
            },
            {
              "title": "Remediate and milestone",
              "body": "Fix HRIs, create milestone snapshot, re-review quarterly."
            }
          ]
        },
        {
          "type": "diagram",
          "diagram": {
            "type": "mermaid",
            "title": "WAFR workflow",
            "source": "flowchart LR\n  W[Workload] --> Q[Pillar Q&A]\n  Q --> H[HRIs]\n  H --> R[Remediation]\n  R --> M[Milestone]"
          }
        }
      ]
    },
    {
      "heading": "Code walkthrough",
      "blocks": [
        {
          "type": "snippet",
          "snippet": {
            "language": "bash",
            "label": "Create workload",
            "code": "aws wellarchitected create-workload \\\n  --workload-name payments-prod \\\n  --environment PRODUCTION \\\n  --review-owner platform@example.com \\\n  --aws-regions us-east-1 \\\n  --lenses wellarchitected",
            "explanation": "Registers workload for structured reviews."
          }
        },
        {
          "type": "snippet",
          "snippet": {
            "language": "bash",
            "label": "List high-risk answers",
            "code": "aws wellarchitected list-answers \\\n  --workload-id <id> \\\n  --lens-alias wellarchitected \\\n  --query \"AnswerSummaries[?Risk==`HIGH`].QuestionTitle\"",
            "explanation": "Export HRIs for sprint planning."
          }
        },
        {
          "type": "snippet",
          "snippet": {
            "language": "yaml",
            "label": "Cost allocation tags",
            "code": "Tags:\n  - Key: workload\n    Value: payments-prod\n  - Key: cost-center\n    Value: finops-42",
            "explanation": "Cost pillar needs tags for chargeback."
          }
        },
        {
          "type": "snippet",
          "snippet": {
            "language": "bash",
            "label": "Create milestone",
            "code": "aws wellarchitected create-milestone \\\n  --workload-id <id> \\\n  --milestone-name post-hri-q2 \\\n  --milestone-number 2",
            "explanation": "Snapshots progress after remediation."
          }
        }
      ]
    },
    {
      "heading": "Compare with JavaScript and TypeScript",
      "blocks": [
        {
          "type": "comparisonTable",
          "title": "Cloud vs app patterns",
          "headers": [
            "Aspect",
            "AWS",
            "JS/TS"
          ],
          "rows": [
            [
              "Review",
              "Quarterly WAFR with HRIs",
              "Quarterly dependency audits"
            ],
            [
              "Scope",
              "Cross-account workload",
              "Single repo/service"
            ],
            [
              "Evidence",
              "Config rules + alarms",
              "CI test coverage"
            ]
          ]
        }
      ]
    },
    {
      "heading": "Common mistakes",
      "blocks": [
        {
          "type": "callout",
          "variant": "warning",
          "title": "Pitfalls to avoid",
          "body": "Treating framework as launch-only checklist. Claiming compliance without backup restore proof or alarm runbooks."
        }
      ]
    },
    {
      "heading": "Senior interview depth",
      "blocks": [
        {
          "type": "prose",
          "text": "How to prove it in production: map HRIs to AWS Config rules, CloudWatch alarm coverage, and backup job success metrics. Mature teams block prod deploys while Security HRIs remain open."
        },
        {
          "type": "comparisonTable",
          "title": "Tradeoffs at senior level",
          "headers": [
            "Pattern",
            "Win",
            "Cost / risk"
          ],
          "rows": [
            [
              "Central WAFR guild",
              "Consistent reviews",
              "Bottleneck"
            ],
            [
              "Per-team mini-reviews",
              "Fast feedback",
              "Misses cross-workload deps"
            ],
            [
              "Automated Config",
              "Continuous signals",
              "Tuning needed"
            ]
          ]
        },
        {
          "type": "callout",
          "variant": "warning",
          "title": "What gets you rejected in interviews",
          "body": "Saying you follow all pillars perfectly — rejected. Strong answer: pillars conflict; document tradeoffs and residual risk."
        }
      ]
    }
  ],
  "interviewTakeaways": [
    "Six pillars + review questions + HRIs — continuous improvement lens.",
    "Perfect scores on all pillars are impossible — document tradeoffs.",
    "Link HRIs to Config rules and alarm dashboards in production.",
    "60s: Framework evaluates design via six pillars. Tool tracks workloads and HRIs. Lenses add SaaS context. Prioritize fixes by business risk.",
    "Follow-up: which pillar conflicts most with your architecture?"
  ],
  "commonPitfalls": [
    "Claiming compliance without evidence — rejected; need restore tests and runbooks.",
    "Strong answer: pillar, principle, tradeoff, proving metric.",
    "One-time review at launch only.",
    "Ignoring Sustainability when customers require carbon reporting."
  ],
  "relatedTopicIds": [
    "aws-16-pillar-operational-excellence",
    "aws-16-pillar-security",
    "aws-16-pillar-reliability"
  ],
  "jsTsCorrelations": [
    {
      "language": "javascript",
      "concept": "ADRs",
      "note": "Architecture Decision Records mirror WAFR tradeoff documentation.",
      "futureTopicSlug": "javascript/cloud/architecture"
    },
    {
      "language": "typescript",
      "concept": "Bounded contexts",
      "note": "TypeScript module boundaries help scope a Well-Architected workload.",
      "futureTopicSlug": "typescript/cloud/architecture"
    }
  ],
  "officialSources": [
    {
      "title": "AWS Well-Architected Framework",
      "url": "https://docs.aws.amazon.com/wellarchitected/latest/framework/welcome.html"
    },
    {
      "title": "Well-Architected Tool User Guide",
      "url": "https://docs.aws.amazon.com/wellarchitected/latest/userguide/intro.html"
    }
  ],
  "animationHint": "flow",
  "scenarioTag": "high-concurrency"
}
