{
  "id": "csharp-06-what-is-an-exception",
  "slug": "what-is-an-exception",
  "title": "What is an exception",
  "moduleId": "csharp-06-exceptions-and-using",
  "order": 1,
  "hook": "An exception is an object derived from System.Exception, thrown with throw, that unwinds the stack until a matching catch or the thread dies. JavaScript can throw a string. C# will not compile that.",
  "sections": [
    {
      "heading": "The CLR model",
      "prose": "Microsoft’s exception overview is blunt: exceptions are types under System.Exception; throw creates a control transfer; the runtime walks frames looking for catch; if nothing handles it, the thread — and often the process — is finished. The object carries Message, StackTrace, InnerException, and sometimes HRESULT. You do not use exceptions for ordinary not-found on a hot cache lookup; you use TryGet or nullable returns. You do use them for broken invariants, I/O that cannot complete, and cancelled work (OperationCanceledException)."
    },
    {
      "heading": "Versus JavaScript throw",
      "prose": "JS throw 42, throw 'nope', throw { code: 500 } are all legal. catch (e) then guesses. TypeScript cannot fully close that hole. In C#, throw new InvalidOperationException(\"lease expired\") is typed; catch clauses match on type (next topics). That is why a Node worker and a .NET SQS worker log failures differently: one may have a string, the other has a type you can filter.",
      "snippets": [
        {
          "language": "csharp",
          "label": "Only Exception-derived throw",
          "code": "static AuthToken RequireToken(string? raw)\n{\n    if (string.IsNullOrWhiteSpace(raw))\n        throw new ArgumentException(\"token missing\", nameof(raw));\n    return new AuthToken(\"sub\", \"iss\", DateTimeOffset.UtcNow.AddHours(1));\n}",
          "explanation": "The compiler rejects throw raw or throw 401. Callers catch ArgumentException or let it bubble. AuthToken is the record from module 05."
        }
      ]
    },
    {
      "heading": "What this module defers",
      "prose": "If a Task faults and nobody observes the exception, that is an async story — unobserved task exceptions are module 13. If you thought a destructor would catch leaks, that is finalization — module 14. Here we stay on throw, catch, wrap, and Dispose."
    }
  ],
  "interviewTakeaways": [
    "throw requires System.Exception (or derived).",
    "Unhandled exceptions unwind to the thread start; hosts may tear down the process.",
    "Do not use exceptions for expected cache misses."
  ],
  "commonPitfalls": [
    "Translating JS habits: throwing strings or anonymous objects.",
    "Using exceptions for control flow in a tight CSV import loop."
  ],
  "relatedTopicIds": [
    "csharp-06-try-catch-finally",
    "csharp-06-exception-hierarchy",
    "csharp-05-records",
    "csharp-13-async-exceptions"
  ],
  "jsTsCorrelations": [
    {
      "language": "javascript",
      "concept": "throw any value",
      "note": "JS exceptions are not a type hierarchy you can rely on. C# exceptions always derive from Exception.",
      "futureTopicSlug": "javascript/errors/throw"
    },
    {
      "language": "typescript",
      "concept": "unknown in catch",
      "note": "TS catch (e: unknown) is the honest typing because throw is untyped. C# catch (ArgumentException ex) is exact.",
      "futureTopicSlug": "typescript/errors/unknown-catch"
    }
  ],
  "officialSources": [
    {
      "title": "Exceptions and exception handling",
      "url": "https://learn.microsoft.com/en-us/dotnet/csharp/fundamentals/exceptions/"
    }
  ],
  "animationHint": "flow",
  "scenarioTag": "auth-token"
}
