{
  "id": "typescript-03-assignability-and-subtyping",
  "slug": "assignability-and-subtyping",
  "title": "Assignability, subtyping, and excess property checks",
  "moduleId": "typescript-03-type-system-unions-intersections",
  "order": 4,
  "hook": "TypeScript decides whether one type can stand in for another using structural rules — if the shape fits, the assignment works.",
  "sections": [
    {
      "heading": "What is this?",
      "blocks": [
        {
          "type": "prose",
          "text": "**Assignability** asks whether Source can be used where Target is expected. TypeScript uses **structural subtyping** — Source is assignable if it has at least all properties Target requires with compatible types. This differs from C#'s **nominal** system. **Excess property checks** apply to fresh object literals: extra properties cause errors even when structural rules would otherwise allow them."
        },
        {
          "type": "glossary",
          "title": "Key terms",
          "entries": [
            {
              "term": "structural subtyping",
              "longForm": "structural subtyping",
              "plainDefinition": "Compatibility based on shape, not declared names.",
              "example": "`{ name: string; age: number }` assignable to `{ name: string }`."
            },
            {
              "term": "excess property check",
              "longForm": "excess property checking",
              "plainDefinition": "Fresh object literals cannot include undeclared properties.",
              "example": "`const u: User = { name: \"Ada\", extra: 1 }` — error."
            },
            {
              "term": "fresh object literal",
              "longForm": "fresh object literal",
              "plainDefinition": "A newly written `{ ... }` subject to stricter excess property rules.",
              "example": "Assign through a variable to bypass — usually a code smell."
            }
          ]
        }
      ]
    },
    {
      "heading": "Why does it matter?",
      "blocks": [
        {
          "type": "prose",
          "text": "Union assignability is directional — `\"a\"` fits `string` but not reverse. Excess property checks catch typos in config objects. For C# developers, structural typing is the biggest mental model shift."
        },
        {
          "type": "callout",
          "variant": "remember",
          "title": "Variable vs literal",
          "body": "Excess checks apply to fresh literals, not variables already typed wider."
        }
      ]
    },
    {
      "heading": "How it works step by step",
      "blocks": [
        {
          "type": "steps",
          "title": "Assignability checklist",
          "items": [
            {
              "title": "Required properties present",
              "body": "Target keys must exist on Source."
            },
            {
              "title": "Optionality compatible",
              "body": "Optional target properties can be missing."
            },
            {
              "title": "Union direction",
              "body": "Narrow assigns to wide, not always reverse."
            },
            {
              "title": "Excess check on literals",
              "body": "No extra keys on fresh `{ }`."
            }
          ]
        },
        {
          "type": "diagram",
          "diagram": {
            "type": "mermaid",
            "title": "Structural assignability",
            "source": "flowchart LR\n  S[\"Source\"] --> Q{\"Shape fits?\"}\n  Q -->|yes| OK[\"Assignable\"]\n  Q -->|no| FAIL[\"Error\"]"
          }
        }
      ]
    },
    {
      "heading": "Code walkthrough",
      "blocks": [
        {
          "type": "snippet",
          "snippet": {
            "language": "typescript",
            "label": "Structural subtyping",
            "code": "type Point = { x: number; y: number };\nconst entity: Point & { name: string } = { x: 1, y: 2, name: \"origin\" };\nconst asPoint: Point = entity; // OK",
            "explanation": "Wider variable assigns to narrower structural type when required fields match."
          }
        },
        {
          "type": "snippet",
          "snippet": {
            "language": "typescript",
            "label": "Excess property check",
            "code": "type User = { id: string; name: string };\nfunction saveUser(user: User): void { console.log(user.id); }\n// saveUser({ id: \"1\", name: \"Ada\", email: \"x\" }); // Error\nconst draft = { id: \"1\", name: \"Ada\", email: \"x\" };\nsaveUser(draft); // OK via variable",
            "explanation": "Fresh literal errors on extra email. Variable bypasses excess check structurally."
          }
        },
        {
          "type": "snippet",
          "snippet": {
            "language": "typescript",
            "label": "Union assignability direction",
            "code": "type Status = \"pending\" | \"done\";\nlet narrow: \"pending\" = \"pending\";\nlet wide: Status = narrow; // OK\n// narrow = wide; // Error",
            "explanation": "Literal to union is safe; union to literal is not."
          }
        },
        {
          "type": "snippet",
          "snippet": {
            "language": "typescript",
            "label": "readonly covariance",
            "code": "type Mutable = { items: string[] };\ntype Immutable = { readonly items: readonly string[] };\nconst mut: Mutable = { items: [\"a\"] };\nconst imm: Immutable = mut; // OK\n// const back: Mutable = imm; // Error",
            "explanation": "Mutable assigns to readonly, not reverse."
          }
        }
      ]
    },
    {
      "heading": "Compare with JavaScript and C#",
      "blocks": [
        {
          "type": "comparisonTable",
          "title": "Subtyping models",
          "headers": [
            "Rule",
            "TypeScript",
            "JavaScript",
            "C#"
          ],
          "rows": [
            [
              "Subtype test",
              "Structural shape",
              "No check",
              "Nominal inheritance"
            ],
            [
              "Extra properties",
              "Error on fresh literals",
              "Stored silently",
              "Fixed class shape"
            ],
            [
              "Interface impl",
              "Implicit if shape fits",
              "N/A",
              "Explicit : IInterface"
            ]
          ]
        }
      ]
    },
    {
      "heading": "Common mistakes",
      "blocks": [
        {
          "type": "callout",
          "variant": "warning",
          "title": "Pitfalls to avoid",
          "body": "Assuming C# nominal rules apply. Smuggling typos through intermediate variables. Expecting bidirectional union assignability."
        }
      ]
    },
    {
      "heading": "Senior interview depth",
      "blocks": [
        {
          "type": "prose",
          "text": "strictFunctionTypes makes parameters contravariant. Branding restores nominal-like safety. Optional vs undefined differs under exactOptionalPropertyTypes."
        },
        {
          "type": "comparisonTable",
          "title": "Tradeoffs",
          "headers": [
            "Mechanism",
            "When",
            "Risk"
          ],
          "rows": [
            [
              "Structural match",
              "JSON DTOs",
              "Accidental compatibility"
            ],
            [
              "Excess check",
              "Inline config",
              "Bypassed via variable"
            ],
            [
              "Branded types",
              "IDs",
              "Extra ceremony"
            ]
          ]
        },
        {
          "type": "callout",
          "variant": "warning",
          "title": "What gets you rejected",
          "body": "Calling TypeScript nominal. Reversing union assignability. Unaware readonly covariance rules."
        }
      ]
    }
  ],
  "interviewTakeaways": [
    "Structural subtyping — compatible shape means assignable.",
    "Excess property checks on fresh literals only.",
    "Union assignability is directional.",
    "readonly accepts mutable, not reverse.",
    "60s: TS asks 'does shape fit?' C# asks 'is it declared?' Excess checks catch literal typos."
  ],
  "commonPitfalls": [
    "Expecting C# nominal rules.",
    "Variable workaround for excess errors.",
    "Strong answer: 'Structural fit. Fresh literal excess checks. readonly covariance.'"
  ],
  "relatedTopicIds": [
    "typescript-03-union-types",
    "typescript-03-intersection-types",
    "typescript-03-readonly-and-immutability",
    "typescript-03-type-system-vs-csharp"
  ],
  "jsTsCorrelations": [
    {
      "language": "javascript",
      "concept": "duck typing",
      "note": "TypeScript formalizes JS duck typing into compile-time rules.",
      "futureTopicSlug": "javascript/objects/property-access"
    },
    {
      "language": "typescript",
      "concept": "nominal typing",
      "note": "C# requires explicit inheritance or interface implementation.",
      "futureTopicSlug": "csharp/type-system/custom-type-kinds"
    }
  ],
  "officialSources": [
    {
      "title": "TypeScript handbook — Type Compatibility",
      "url": "https://www.typescriptlang.org/docs/handbook/type-compatibility.html"
    }
  ]
}
